{
  "schema_version": "x07.mcp.corpus.summary@0.1.0",
  "generated_at": "2026-03-31T00:00:00Z",
  "tool": "x07-mcp-test",
  "tool_version": "0.1.0-alpha.4",
  "target": { "kind": "file", "transport": "file", "ref": "corpus/manifests/quality-report-001.json", "meta": {} },
  "ok": false,
  "errors": [{ "id": "corpus.stub", "message": "corpus run is a placeholder (not implemented yet)" }],
  "warnings": [],
  "details": {
    "report_id": "quality-report-001",
    "results": [
      {
        "server_id": "good-http",
        "status": "stub",
        "ok": false,
        "result_path": "out/corpus/quality-report-001/good-http/result.json",
        "out_dir": "out/corpus/quality-report-001/good-http"
      }
    ],
    "counts": { "total": 1, "ok": 0, "failed": 1, "stub": 1 }
  }
}
